{
  "schema_version": 1,
  "id": "monero-zh-hans-source",
  "source_type": "official-source",
  "claim": "Exact ordered dictionary array and applicable file-level license header reviewed. Source-token extraction and byte hashes are independently checked against the public fixture; no complete phrase is stored here. Reviewed 2026-09-29; response byte SHA-256 4a38fbe7279616aa78aa11dbcf425d0ba5305fd2089cb4421d544f2c540d50fd. See docs/research/batches/monero-polyseed.md.",
  "url": "https://raw.githubusercontent.com/monero-project/monero/2f9d1bbb2c553dc75f3335bd1452117dfddd86fa/src/mnemonics/chinese_simplified.h",
  "revision": "2f9d1bbb2c553dc75f3335bd1452117dfddd86fa",
  "verified_on": "2026-09-29",
  "record_ids": [
    "monero-zh-hans"
  ]
}
