{
  "schema_version": 1,
  "id": "wallet-temple-source",
  "source_type": "official-source",
  "claim": "Pinned vault spawn generates Bip39.generateMnemonic(128) when no mnemonic is supplied, then creates separate Tezos and EVM account credentials.",
  "url": "https://raw.githubusercontent.com/madfish-solutions/templewallet-extension/7770f23fffd85a96c2148335bca7c946c84d9337/src/lib/temple/back/vault/index.ts",
  "revision": "7770f23fffd85a96c2148335bca7c946c84d9337",
  "verified_on": "2026-09-29",
  "record_ids": [
    "temple"
  ]
}
