{
  "schema_version": 1,
  "id": "cake-wallet-groups",
  "source_type": "official-source",
  "claim": "Groups reuse an existing wallet.seed. Native Nano, Electrum, Monero non-BIP39, Zano non-BIP39, Decred native15 and nonseed wallets are filtered out. Reuse is not fresh mnemonic generation.",
  "url": "https://raw.githubusercontent.com/cake-tech/cake_wallet/9679f91a8c9f63d00500c2b7cc18daf00949bdef/lib/view_model/wallet_groups_display_view_model.dart",
  "revision": "9679f91a8c9f63d00500c2b7cc18daf00949bdef",
  "verified_on": "2026-09-29",
  "record_ids": [
    "cake-wallet-arbitrum-bip39-group-android",
    "cake-wallet-arbitrum-bip39-group-ios",
    "cake-wallet-arbitrum-bip39-group-linux",
    "cake-wallet-arbitrum-bip39-group-macos",
    "cake-wallet-base-bip39-group-android",
    "cake-wallet-base-bip39-group-ios",
    "cake-wallet-base-bip39-group-linux",
    "cake-wallet-base-bip39-group-macos",
    "cake-wallet-bitcoin-bip39-group-android",
    "cake-wallet-bitcoin-bip39-group-ios",
    "cake-wallet-bitcoin-bip39-group-linux",
    "cake-wallet-bitcoin-bip39-group-macos",
    "cake-wallet-bitcoin-cash-bip39-group-android",
    "cake-wallet-bitcoin-cash-bip39-group-ios",
    "cake-wallet-bitcoin-cash-bip39-group-linux",
    "cake-wallet-bitcoin-cash-bip39-group-macos",
    "cake-wallet-bnb-chain-bip39-group-android",
    "cake-wallet-bnb-chain-bip39-group-ios",
    "cake-wallet-bnb-chain-bip39-group-linux",
    "cake-wallet-bnb-chain-bip39-group-macos",
    "cake-wallet-decred-bip39-group-android",
    "cake-wallet-decred-bip39-group-ios",
    "cake-wallet-dogecoin-bip39-group-android",
    "cake-wallet-dogecoin-bip39-group-ios",
    "cake-wallet-dogecoin-bip39-group-linux",
    "cake-wallet-dogecoin-bip39-group-macos",
    "cake-wallet-ethereum-bip39-group-android",
    "cake-wallet-ethereum-bip39-group-ios",
    "cake-wallet-ethereum-bip39-group-linux",
    "cake-wallet-ethereum-bip39-group-macos",
    "cake-wallet-litecoin-bip39-group-android",
    "cake-wallet-litecoin-bip39-group-ios",
    "cake-wallet-litecoin-bip39-group-linux",
    "cake-wallet-litecoin-bip39-group-macos",
    "cake-wallet-monero-bip39-group-android",
    "cake-wallet-monero-bip39-group-ios",
    "cake-wallet-monero-bip39-group-linux",
    "cake-wallet-monero-bip39-group-macos",
    "cake-wallet-nano-bip39-group-android",
    "cake-wallet-nano-bip39-group-ios",
    "cake-wallet-nano-bip39-group-linux",
    "cake-wallet-nano-bip39-group-macos",
    "cake-wallet-polygon-bip39-group-android",
    "cake-wallet-polygon-bip39-group-ios",
    "cake-wallet-polygon-bip39-group-linux",
    "cake-wallet-polygon-bip39-group-macos",
    "cake-wallet-solana-bip39-group-android",
    "cake-wallet-solana-bip39-group-ios",
    "cake-wallet-solana-bip39-group-linux",
    "cake-wallet-solana-bip39-group-macos",
    "cake-wallet-tron-bip39-group-android",
    "cake-wallet-tron-bip39-group-ios",
    "cake-wallet-tron-bip39-group-linux",
    "cake-wallet-tron-bip39-group-macos",
    "cake-wallet-zano-bip39-group-android",
    "cake-wallet-zano-bip39-group-ios",
    "cake-wallet-zcash-bip39-group-android",
    "cake-wallet-zcash-bip39-group-ios"
  ]
}
