{
  "schema_version": 1,
  "id": "cake-wallet-ethereum-service",
  "source_type": "official-source",
  "claim": "ethereum source create/import/keys service at exact commit; credential branches distinguish new12/24 words from existing phrase and non-mnemonic key material. See batch matrix for exact exceptions and dependency limits.",
  "url": "https://raw.githubusercontent.com/cake-tech/cake_wallet/9679f91a8c9f63d00500c2b7cc18daf00949bdef/cw_evm/lib/evm_chain_wallet_service.dart",
  "revision": "9679f91a8c9f63d00500c2b7cc18daf00949bdef",
  "verified_on": "2026-09-29",
  "record_ids": [
    "cake-wallet-ethereum-bip39-create-android",
    "cake-wallet-ethereum-bip39-create-ios",
    "cake-wallet-ethereum-bip39-create-linux",
    "cake-wallet-ethereum-bip39-create-macos",
    "cake-wallet-ethereum-bip39-group-android",
    "cake-wallet-ethereum-bip39-group-ios",
    "cake-wallet-ethereum-bip39-group-linux",
    "cake-wallet-ethereum-bip39-group-macos",
    "cake-wallet-ethereum-bip39-import-android",
    "cake-wallet-ethereum-bip39-import-ios",
    "cake-wallet-ethereum-bip39-import-linux",
    "cake-wallet-ethereum-bip39-import-macos",
    "cake-wallet-ethereum-hardware-android",
    "cake-wallet-ethereum-hardware-ios",
    "cake-wallet-ethereum-hardware-linux",
    "cake-wallet-ethereum-hardware-macos",
    "cake-wallet-ethereum-private-key-android",
    "cake-wallet-ethereum-private-key-ios",
    "cake-wallet-ethereum-private-key-linux",
    "cake-wallet-ethereum-private-key-macos"
  ]
}
