{
  "schema_version": 1,
  "id": "cake-wallet-bitcoin-doc",
  "source_type": "official-documentation",
  "claim": "Official bitcoin per-cryptocurrency Seed Format/Seed Types and recovery guidance, retrieved2026-09-29. Source snapshot controls exact implementation; mutable documentation is not a binary attestation. Decred native15 predates6.4.2; Zano native26 predates6.4.3 where applicable.",
  "url": "https://docs.cakewallet.com/cryptos/bitcoin/",
  "revision": "HTTP-body-sha256-08ce2c5fe727627a4bf504f07d607fc4ce0b5cd25933c30921dddcbd80f1258c",
  "verified_on": "2026-09-29",
  "record_ids": [
    "cake-wallet-bitcoin-bip39-create-android",
    "cake-wallet-bitcoin-bip39-create-ios",
    "cake-wallet-bitcoin-bip39-create-linux",
    "cake-wallet-bitcoin-bip39-create-macos",
    "cake-wallet-bitcoin-bip39-group-android",
    "cake-wallet-bitcoin-bip39-group-ios",
    "cake-wallet-bitcoin-bip39-group-linux",
    "cake-wallet-bitcoin-bip39-group-macos",
    "cake-wallet-bitcoin-bip39-import-android",
    "cake-wallet-bitcoin-bip39-import-ios",
    "cake-wallet-bitcoin-bip39-import-linux",
    "cake-wallet-bitcoin-bip39-import-macos",
    "cake-wallet-bitcoin-electrum-create-android",
    "cake-wallet-bitcoin-electrum-create-ios",
    "cake-wallet-bitcoin-electrum-create-linux",
    "cake-wallet-bitcoin-electrum-create-macos",
    "cake-wallet-bitcoin-electrum-import-android",
    "cake-wallet-bitcoin-electrum-import-ios",
    "cake-wallet-bitcoin-electrum-import-linux",
    "cake-wallet-bitcoin-electrum-import-macos",
    "cake-wallet-bitcoin-hardware-android",
    "cake-wallet-bitcoin-hardware-ios",
    "cake-wallet-bitcoin-hardware-linux",
    "cake-wallet-bitcoin-hardware-macos",
    "cake-wallet-bitcoin-mweb-import-android",
    "cake-wallet-bitcoin-mweb-import-ios",
    "cake-wallet-bitcoin-mweb-import-linux",
    "cake-wallet-bitcoin-mweb-import-macos",
    "cake-wallet-bitcoin-view-only-android",
    "cake-wallet-bitcoin-view-only-ios",
    "cake-wallet-bitcoin-view-only-linux",
    "cake-wallet-bitcoin-view-only-macos"
  ]
}
