{
  "schema_version": 1,
  "id": "cake-wallet-nano-derive",
  "source_type": "official-source",
  "claim": "Native Nano decodes mnemonic entropy directly; HD routes to nanoutil. Service create/restore do not forward credential passphrase; seed getter returns null for retained hex-only material.64-hex import may reconstruct24 words,128-hex retains non-mnemonic seed.",
  "url": "https://raw.githubusercontent.com/cake-tech/cake_wallet/9679f91a8c9f63d00500c2b7cc18daf00949bdef/cw_nano/lib/nano_wallet.dart",
  "revision": "9679f91a8c9f63d00500c2b7cc18daf00949bdef",
  "verified_on": "2026-09-29",
  "record_ids": [
    "cake-nano-hd-create",
    "cake-nano-hd-import",
    "cake-nano-native",
    "cake-wallet-nano-bip39-create-android",
    "cake-wallet-nano-bip39-create-ios",
    "cake-wallet-nano-bip39-create-linux",
    "cake-wallet-nano-bip39-create-macos",
    "cake-wallet-nano-bip39-group-android",
    "cake-wallet-nano-bip39-group-ios",
    "cake-wallet-nano-bip39-group-linux",
    "cake-wallet-nano-bip39-group-macos",
    "cake-wallet-nano-bip39-import-android",
    "cake-wallet-nano-bip39-import-ios",
    "cake-wallet-nano-bip39-import-linux",
    "cake-wallet-nano-bip39-import-macos",
    "cake-wallet-nano-hex32-import-android",
    "cake-wallet-nano-hex32-import-ios",
    "cake-wallet-nano-hex32-import-linux",
    "cake-wallet-nano-hex32-import-macos",
    "cake-wallet-nano-hex64-import-android",
    "cake-wallet-nano-hex64-import-ios",
    "cake-wallet-nano-hex64-import-linux",
    "cake-wallet-nano-hex64-import-macos",
    "cake-wallet-nano-native-create-android",
    "cake-wallet-nano-native-create-ios",
    "cake-wallet-nano-native-create-linux",
    "cake-wallet-nano-native-create-macos",
    "cake-wallet-nano-native-import-android",
    "cake-wallet-nano-native-import-ios",
    "cake-wallet-nano-native-import-linux",
    "cake-wallet-nano-native-import-macos"
  ]
}
