{
  "schema_version": 1,
  "id": "monero-fr-source",
  "source_type": "official-source",
  "claim": "Exact ordered dictionary array and applicable file-level license header reviewed. Source-token extraction and byte hashes are independently checked against the public fixture; no complete phrase is stored here. Reviewed 2026-09-29; response byte SHA-256 f4e42ab4eb9824a2cd829f132e33dfc46ae31c5788a37c9726d393e7cc809a82. See docs/research/batches/monero-polyseed.md.",
  "url": "https://raw.githubusercontent.com/monero-project/monero/2f9d1bbb2c553dc75f3335bd1452117dfddd86fa/src/mnemonics/french.h",
  "revision": "2f9d1bbb2c553dc75f3335bd1452117dfddd86fa",
  "verified_on": "2026-09-29",
  "record_ids": [
    "monero-fr"
  ]
}
